{
  "id": "irodori-v4-1-anime-audiocpp-q8",
  "date": "2026-09-10",
  "title": "audio.cppがIrodori-TTS v4.1 AnimeのQ8 GGUFを追加",
  "summary": "audio.cppは2026年9月9日、phasefield-audio/Irodori-TTS-v4.1-AnimeをIrodori-TTS v4.1 Small互換のQ8_0 GGUFパッケージとして追加し、audio-cpp/audio.cpp-ggufにもモデル実体を公開した。audio.cppはmacOSとApple Siliconをサポートし、Irodori系ではTTS、voice cloning、Voice Design、発話制御を同じネイティブランタイムで扱える。",
  "whyItMatters": "キャラクター音声用途では、通常のv4.1-Smallとは異なるアニメ調ファインチューニングをApple Silicon上でPython/TorchAO経路なしに比較できる。Anime派生は独自アノテーションのためcaption conditioningやemoji controlがベースと異なる可能性があり、まず短いA/B試験で声質・制御性・速度を確認する価値がある。",
  "status": "TRY",
  "tags": [
    "Irodori-TTS",
    "audio.cpp",
    "Apple-Silicon",
    "GGUF",
    "TTS",
    "Voice-Design"
  ],
  "sources": [
    {
      "title": "Add Irodori Anime GGUF package support",
      "url": "https://github.com/0xShug0/audio.cpp/commit/98101a4d6fa1d1ef29f5a0fa52dd5585d9cbcb5a",
      "publisher": "GitHub",
      "publishedAt": "2026-09-09T00:29:46Z"
    },
    {
      "title": "audio-cpp/audio.cpp-gguf commit history",
      "url": "https://huggingface.co/audio-cpp/audio.cpp-gguf/commits/main",
      "publisher": "Hugging Face"
    },
    {
      "title": "phasefield-audio/Irodori-TTS-v4.1-Anime",
      "url": "https://huggingface.co/phasefield-audio/Irodori-TTS-v4.1-Anime",
      "publisher": "Hugging Face"
    }
  ]
}
